Date,Source,Title,URL,Content
2025-03-09,BBC,NewsNews,https://www.bbc.com/news/bbcverify,"BBC Verify's Nick Eardley takes a look at verified footage and images from a Russian missile attack on a Ukrainian hotel.  BBC Verify has looked into several claims made by Trump during his speech to Congress. The BBC's analysis editor takes a look at President Trump's history with Ukraine - and how it set the stage for this week's events. America has withdrawn its military support for Ukraine, how big of a hole does it leave? America has withdrawn its military support for Ukraine, how big of a "
2025-03-09,BBC,NewsNews,https://www.bbc.com/news/in_pictures,"Images on the theme of ""monochrome"" sent in by our readers. Crowds filled the Sambadrome to watch samba schools face off at Rio Carnival.  A selection of the week's best photos from across the African continent and beyond. Around the world, prayers and services are being held in support of the pontiff. Moving accounts of some of the men and women behind the striking images that have encapsulated the war. Crowds filled the Sambadrome to watch samba schools face off at Rio Carnival.  See all the l"
2025-03-09,BBC,Culture & Experiences,https://www.bbc.com/travel/cultural-experiences,"From Manchester to Reykjavík, innovative tours are highlighting forgotten stories and re-incorporating female legacies into the popular tourist narrative. After being sealed off from the outside world for decades and experiencing a mass exodus, Albania is leaning into its culinary roots with the help of grandma chefs. More than a century after its medieval centre served as the backdrop of Nosferatu, a new Oscar-nominated remake is putting this Gothic city back on the map. Soca musician Machel Mo"
2025-03-09,BBC,Style,https://www.bbc.com/culture/style,"Christopher John Rogers’s bold designs have made him the new star of US fashion. Backstage at his New York Fashion Week show, he talks style – and clothes as a ""tool for hope"". As the Oscars approach, Kate Young talks risk taking, intimacy – and why method dressing drives her ""nuts"". Nordic style is easy to wear – and can even cheer us up, say its fans. As Copenhagen Fashion Week approaches, we explore the fun, functional Scandi-girl style movement. ""People are surprised at what I've said yes to"
2025-03-09,BBC,India's rap rebel makes a comeback after battling addiction,https://www.bbc.com/news/articles/czdn0zq7n0zo,"About 15 years ago, an Indian rapper of humble origins broke onto the country's then-infertile hip-hop music scene and transformed it forever. He teased, cajoled and vexed his listeners, daring them to explore the ""devilish"" contours of his mind, as he sang rash rhymes about parties, drugs and ""seducing"" women. His songs played in clubs and weddings, blaring from stereos at big parties and roadside tea stalls alike. Then, at the peak of his career, he vanished. Seven years later, Yo Yo Honey Sin"
2025-03-09,BBC,BBC Homepage,https://www.bbc.com/home,"Civil Service reforms will be radical, McFadden vows Measures including linking the pay of senior officials to performance are expected to be unveiled this week. Syrian leader calls for peace after hundreds of civilians killed How Trump's threats have revived Canada's Liberal Party Not so demure any more: The rise of 'free the nipple' fashion Countries can't be forced into Ukraine peace coalition, minister says UK enjoys warmer temperatures but cold weather set to return Man charged with murder "
2025-03-09,BBC,NewsNews,https://www.bbc.com/news/politics,"Measures including linking the pay of senior officials to performance are expected to be unveiled this week. Kemi Badenoch previously criticised how some foreign criminals and illegal migrants were using the act. Starmer is confronting difficult dilemmas after Zelensky and Trump's showdown, writes Laura Kuenssberg. Police detain a man after he scales the Elizabeth Tower in Westminster on Saturday morning. Funds worth £2.5bn - meant to help Ukrainians - remain frozen in a UK bank account over a r"
2025-03-09,BBC,Your pictures on the theme of 'monochrome' ,https://www.bbc.com/news/articles/c05m6lvj7z0o,"We asked our readers to send in their best pictures on the theme of ""monochrome"". Here is a selection of the photographs we received from around the world. The next theme is ""my best photo"" and the deadline for entries is 18 March. The pictures will be published later that week and you will be able to find them, along with other galleries, on the In Pictures section of the BBC News website. You can upload your entries directly here or email them to yourpics@bbc.co.uk. Terms and conditions apply."
2025-03-09,BBC,DR Congo offers $5m bounties for rebel leaders,https://www.bbc.com/news/articles/clyzkv7yl43o,"The Democratic Republic of Congo government has offered a reward of $5m (£4m) for help arresting three leaders of a rebel group which has seized much of the east of the country this year. Corneille Nangaa, a former head of DR Congo's electoral commission, now leads the Congo River Alliance, which includes the M23 rebel group. He has addressed large rallies in the cities under the group's control. The bounty is also on offer for M23 leaders Sultani Makenga and Bertrand Bisimwa.  Last year the thr"
2025-03-09,BBC,Who is in the running to replace Trudeau as Liberal Party leader?,https://www.bbc.com/news/articles/c3904r98lnlo,"Canadians are voting to decide who will take over from Justin Trudeau as the leader of the country's governing Liberal Party, in a crucial vote that will change the face of Canadian politics. About 140,000 of the party's members have been voting for their preferred candidate, with results expected to be announced by Sunday evening (the BBC will have live coverage). The new leader will become the country's prime minister. But because the Liberals are a minority government, holding onto the top jo"
2025-03-09,BBC,Podcasts,https://www.bbc.com/audio/categories,Copyright 2025 BBC. All rights reserved.  The BBC is not responsible for the content of external sites. Read about our approach to external linking.  
2025-03-09,BBC,Business,https://www.bbc.com/business,"Across the country, Canadians are defiant in boycotting American goods and travel even as Trump promises another temporary reprieve. Chancellor Rachel Reeves will give more detail about the government's plans for the UK economy. Gain the leading edge with global insights for the boardroom and beyond, in your inbox every Wednesday. Employers added 151,000 jobs in February but there was a drop in federal employment. The president has reversed US policy and says he trusts Putin and finds dealing wi"
2025-03-09,BBC,Migrant deported in chains: 'No-one will go to US illegally now',https://www.bbc.com/news/articles/cx2gjjrzm54o,"Gurpreet Singh was handcuffed, his legs shackled and a chain tied around his waist. He was led on to the tarmac in Texas by US Border Patrol, towards a waiting C-17 military transport aircraft. It was 3 February and, after a months-long journey, he realised his dream of living in America was over. He was being deported back to India. ""It felt like the ground was slipping away from underneath my feet,"" he said. Gurpreet, 39, was one of thousands of Indians in recent years to have spent their life"
2025-03-09,BBC,Books,https://www.bbc.com/culture/books,"The actor and writer states the importance of young readers having a feeling of inclusion. The novel will revisit Dolphin and Star, who grew up dealing with their mother’s bipolar disorder. Families are asked to decorate potatoes instead of little people this World Book Day. Children in Bradford preparing for World Book Day say reading books is an ""important"" thing to do. Author Michael Rosen has been reading to children as a new library is unveiled at Evelina London. Author Sophie Elmhirst wrot"
2025-03-09,BBC,"Israeli tourist and homestay host gang-raped in India, police say",https://www.bbc.com/news/articles/cd92y5np4xgo,"Two women were gang-raped and a man was killed in an attack near a popular Unesco World Heritage site in southern India, according to police.  The two women - an Israeli tourist and an Indian homestay operator - were stargazing with three male tourists near a lake in the city of Hampi, Karnataka, when they were attacked by a group of men on Thursday night, police superintendent Ram Arasiddi told Reuters. Arasiddi said the assailants pushed the men into the Tungabhadra River canal before raping t"
2025-03-09,BBC,NewsNews,https://www.bbc.com/news/scotland,"A vigil will be held later by friends of Amen Teklay, who died after an incident in Glasgow last Wednesday. Linda Sinclair has been recognised by the Royal Humane Society and Police Scotland for the rescue  in Orkney. Police Scotland is investigating the incident at the Ayshire resort owned by the Trump Organisation. Five-try Scotland overcome a hugely spirited Wales in a frenetic Six Nations contest at Murrayfield, condemning the visitors to a 16th defeat in a row. A selection of photographs su"
2025-03-09,BBC,How Trump's threats have changed everything about Canada's politics,https://www.bbc.com/news/articles/cd7eyz3yn5do,"If you had asked Canadians a few months ago who would win the country's next general election, most would have predicted a decisive victory for the Conservative Party. That outcome does not look so certain now. In the wake of US President Donald Trump's threats against Canada, Prime Minister Justin Trudeau's Liberal Party has surged in the polls, shrinking the double-digit lead their Conservative rivals had held steadily since mid-2023. The dramatic change in the country's political landscape re"
2025-03-09,BBC,Three suspects at large after 12 injured in Toronto pub shooting ,https://www.bbc.com/news/articles/c80ygg9yzrmo,"Three suspects are still at large after 12 people were injured in a shooting at a pub in Toronto, police in the Canadian city say. The shooting took place at 22:39 on Friday local time (03:39 GMT Saturday) near  Scarborough city centre in eastern Toronto. Authorities said six people suffered bullet wounds and others were hurt by flying or broken glass. The injuries were not life-threatening, they said. Toronto police said the three men, armed with an assault rifle and handguns, had entered the p"
2025-03-09,BBC,NewsNews,https://www.bbc.com/news/world/asia,"Indian deportee tells BBC about his risky journey and how Trump’s tactics are spreading fear.  At least one man has died in floodwaters and military personnel have been injured in the wild weather. Once a close ally of President Yoon Suk-Yeol, Han tells the BBC how and why he turned against him. Thomas Gabriel Perera was killed by Jordanian security forces while trying to enter Israel illegally. A 50-year-old directive that policed students' hairstyles was found to be unconstitutional. At least "
2025-03-09,BBC,Watch: Man survives being run over by train,https://www.bbc.com/news/videos/cq6yzll9j92o,"A man has survived being run over by a train while sleeping by train tracks in Peru, local authorities said. Surveillance footage shows him lying motionless before a slow-moving cargo train makes contact with him. He gets to his feet shortly after the incident in Lima. ""He apparently was in a state of intoxication, fell asleep along the train tracks and did not feel the train coming,"" said local official General Javier Avalos. Remarkably the man suffered only minor injuries to his left arm, Gene"
2025-03-09,BBC,Future of Business,https://www.bbc.com/business/future-of-business,"The government is proposing changes to copyright law. The data centre, at Cambois in Northumberland, is intended to provide computing power to tech firms. The collaboration will see students and staff gain access to funding and ""cutting-edge"" AI tools. Northumberland councillors will be voting on whether to allow a data centre to be built in Cambois. The centre is the first major new academic department at Cambridge to be established this century. The scheme, for all secondaries in Lancashire, w"
2025-03-09,BBC,Women share their bittersweet experience after taking weight-loss drugs,https://www.bbc.com/news/articles/cly62lmpll3o,"When Branneisha Cooper was overweight, she felt both invisible and like she stood out. Her friends would get attention when they were out together, while she was overlooked. But she also had a sense that everyone was staring at her, scrutinising her. Everyday scenarios were daunting: fairground rides (would she fit in the seat?), working out (would it hurt?), clothes shopping (would she find attractive clothing in her size?). At the end of 2022, Branneisha, now 28 and working in Texas for a majo"
2025-03-09,BBC,Earth,https://www.bbc.com/future-planet,"Residents are warned power may not return for days as further heavy rainfall is forecast. Wind and wave power is set to be included in calculations of the size of countries' economies for the first time, as part of changes approved at the United Nations. Months after a deadly collapse, some seek compensation, saying Kiteezi dumpsite is still unsafe. Essential climate news and hopeful developments across the globe, every Tuesday in your inbox. Urine was used as fertiliser in ancient Rome and Chin"
2025-03-09,BBC,Starmer praised for statesman role abroad but can he show 'same mojo' at home?,https://www.bbc.com/news/articles/cyvend06zmlo,"""Trump may be the best thing to happen to Starmer,"" says a diplomat, suggesting the brash property tycoon busy upending the world order might be just what the strait-laced prime minister - who's been dragging in the polls - needs. One of Labour's business backers calls it ""the PM's finest hour"" - a Remainer leader putting Britain at the heart of international action as Trump rattles the Western world's cage.  Sir Keir Starmer has certainly been incredibly visible – in the White House, leading a "
2025-03-09,BBC,Trump’s demands over nuclear deal rejected by Iran,https://www.bbc.com/,Justin Trudeau's party was headed for near-certain defeat - until the US president said he wanted to make Canada the 51st state. Residents are warned power may not return for days as further heavy rainfall is forecast. Justin Trudeau's party was headed for near-certain defeat - until the US president said he wanted to make Canada the 51st state. Residents are warned power may not return for days as further heavy rainfall is forecast. More than 700 civilians of the Alawite religious minority have
2025-03-09,BBC,"



",https://shop.bbc.com/,"Spend 
    
      $100.00
    
  
 to get free shipping.
 Your cart is currently empty. 
            Shipping, taxes, and discounts calculated at checkout.
            Orders will be processed in USD.
           Led by pathologist Dr Nikki Alexander and forensic scientist Jack Hodgson, no case is ever the same for the investigators. A serial killer resurfaces, death stalks a campus, a mummified woman rocks a community, bodies are found entombed underground and deep fakes obscure the truth. As th"
2025-03-09,BBC,Destinations,https://www.bbc.com/travel/destinations/middle-east,"Egypt may have the Pyramids of Giza, but Iraq has the Ziggurat of Ur – an incredibly well-preserved engineering achievement that towers over the ruins of an important ancient city. Along a single road cutting across the heart of Iraq, you can see where people first learned to write, use maths and invent the wheel. Egypt may have the Pyramids of Giza, but Iraq has the Ziggurat of Ur – an incredibly well-preserved engineering achievement that towers over the ruins of an important ancient city. Alo"
2025-03-09,BBC,AI v the Mind,https://www.bbc.com/innovation/ai-v-the-mind,Inkblot tests play with the human imagination and our mind's ability to impart meaning onto the world around us – but what does AI see in them? Our hands perform thousands of complex tasks every day – can artificial intelligence help robots match these extraordinary human appendages? The brain often blurs the senses – a fact that marketers often use in the design of food packaging. And AIs appear to do the same. Artificial intelligence-powered speech synthesisers can now hold eerily realistic sp
2025-03-09,BBC,Radio Stations,https://www.bbc.com/audio/stations,"News & views from the BBC's international radio station. Interviews, news and analysis of the day’s global events. Schedule Inquisitive speech radio to make sense of your world. 'Accidental' severing of undersea cables or pipelines seems an almost daily occurrence. But how reliant are we on this infrastructure and what steps are being taken to protect it? Schedule Copyright 2025 BBC. All rights reserved.  The BBC is not responsible for the content of external sites. Read about our approach to ex"
2025-03-09,BBC,BBC Weather,https://www.bbc.com/weather," Weather forecasts for thousands of locations around the world This video can not be played UK enjoys warmer temperatures but cold weather set to return Sunny and balmy weather continues on Sunday after the UK's warmest day of the year so far on Saturday. Weather for the Week Ahead. Video, 00:03:29Weather for the Week Ahead It's turning chillier next week but will it last? Stav Danaos has the long-range forecast. Body found in floodwaters and troops injured in Australia storm At least one man ha"
2025-03-09,BBC,Destinations,https://www.bbc.com/travel/destinations/central-america,"Deeply rooted in Costa Rican and Nicaraguan culture, this staple of rice and beans with a side of eggs gets a spicy kick from Salsa Lizano (a sauce similar to Worcestershire). In southern Belize, a sweet and creamy heritage drink made from seaweed has become a symbol of the country's sustainable underwater farming initiatives. Deeply rooted in Costa Rican and Nicaraguan culture, this staple of rice and beans with a side of eggs gets a spicy kick from Salsa Lizano (a sauce similar to Worcestershi"
2025-03-09,BBC,World’s Table,https://www.bbc.com/travel/worlds-table,"Kek lapis is a sublime art form, involving numerous colours and flavours commingling into an oh-so-soft and delicious cake that hides a kaleidoscope of intricate geometric patterns. Italian cuisine may be one of the most recognised and loved in the world. But now, a food historian is arguing that the Italian food as we know it is barely a few decades old. Kek lapis is a sublime art form, involving numerous colours and flavours commingling into an oh-so-soft and delicious cake that hides a kaleid"
2025-03-09,BBC,Art & Design,https://www.bbc.com/culture/art,"Performers and visitors to the famous gothic cathedral in the midst of the River Seine may find some subtle differences to the way sound bounces around its walls. The construction of the Australian icon was plagued by technical problems, soaring costs, public anger and political infighting. In 1965, BBC Tonight visited the construction site. In the past month alone, shadowy portraits have been found hidden in longstanding masterpieces by Titian and Picasso. What can they and other such discoveri"
2025-03-09,BBC,NewsNews,https://www.bbc.com/news/world/africa,"The M23 rebel group has seized large parts of the mineral-rich eastern DR Congo this year. Months after a deadly collapse, some seek compensation, saying Kiteezi dumpsite is still unsafe. Pretoria refuses to respond directly to the latest criticism of the country from President Trump. The shooting during an evacuation mission may constitute a war crime, a UN official says. Tunisian tennis star Ons Jabeur explains why she chose to become an ambassador for the World Food Programme and her hopes fo"
2025-03-09,BBC,NewsNews,https://www.bbc.com/news/uk,"Measures including linking the pay of senior officials to performance are expected to be unveiled this week. Police detain a man after he scales the Elizabeth Tower in Westminster on Saturday morning. Kemi Badenoch previously criticised how some foreign criminals and illegal migrants were using the act. At a time of global tensions, King Charles emphasises the importance of countries working together. The Reform UK leader acknowledges the row has ""dented"" the ""sense of unity"" in his party. Polic"
2025-03-09,BBC,Destinations,https://www.bbc.com/travel/destinations/africa,"As overcrowded European destinations struggle to deal with hordes of travellers, some places not only offer an alternative to mass tourism but actively want you to visit. This year's Global Responsible Tourism Award winners demonstrate that travel can be inclusive, climate-friendly, nature-positive and a positive force for local communities. As overcrowded European destinations struggle to deal with hordes of travellers, some places not only offer an alternative to mass tourism but actively want"
2025-03-09,BBC,'It's a struggle' - Djokovic loses again,https://www.bbc.com/sport/tennis/articles/crknjg66k18o,"Novak Djokovic has lost three matches in a row for the first time since 2018 Novak Djokovic suffered his third straight defeat as Dutch lucky loser Botic van de Zandschulp pulled off a shock victory in the second round at Indian Wells. The seventh seed lost 6-2 3-6 6-1 to the world number 85 in a subdued performance. Since memorably beating Carlos Alcaraz in the Australian Open quarter-finals, the 37-year-old has lost to Alexander Zverev in the semi-finals in Melbourne, Matteo Berrettini in Doha"
2025-03-09,BBC,Executive Lounge,https://www.bbc.com/business/executive-lounge,"Cherie Clonan, CEO of The Digital Picnic, explains how free dinners, burnout-preventing days off and even ADHD assessments have boosted employee wellbeing – and her bottom line. Perhaps no app has mastered user loyalty quite like Duolingo, the gamified language-learning platform 34 million people a day can't put down. Microsoft is turning to AI to make its workplace more inclusive Zoom chief product officer Smita Hashim explains why even video-chat innovators need the physical space – with a lit"
2025-03-09,BBC,'My best friend went to work - and was crushed to death by rubbish',https://www.bbc.com/news/articles/cvgepq6269vo,"Fighting back the tears, 22-year-old rubbish collector Okuku Prince recalls the moment his best friend's lifeless body was found at a massive rubbish dump in Uganda's capital, Kampala. The landslide at the Kiteezi dump last August killed 30 people, including his friend Sanya Kezia. ""I think some people are still underneath the garbage,"" he tells the BBC. Many of them eked out a living by washing and selling whatever discarded items they found that still had value - anything from fishing nets to "
2025-03-09,BBC,Pope Francis thanks medical staff for 'thoughtful' and 'tender' care,https://www.bbc.com/news/articles/cjw27gnjjjyo,"Pope Francis has issued a statement from his hospital bed thanking medical workers caring for him and others who are unwell.  ""While I am here, I think of the many people who are.. close to the sick,"" he said, describing them as ""bringing a little light into the night of pain"". The pontiff has been battling pneumonia and bronchitis for more than three weeks in hospital, but has shown a slight improvement in recent days says the Vatican. The Vatican said on Saturday the Pope had shown a ""good res"
2025-03-09,BBC,NewsNews,https://www.bbc.com/news/world/europe,"Russia has stepped up attacks in recent days as the US paused military and intelligence aid to Kyiv. The Vatican said on Saturday the Pope had shown a ""good response"" in recent days to his treatment at Rome's Gemelli hospital. Danes, who have been loyal allies of Washington, are blindsided by Trump's insistence on taking over Greenland. The foreign ministers of France, Germany, Italy and Britain welcomed the plan, which calls for Gaza to be rebuilt over five years.  Roman Dobrokhotov tells the B"
2025-03-09,BBC,Man arrested after climbing Big Ben's Elizabeth Tower,https://www.bbc.com/news/articles/ce302dl17yno,"A man has been arrested after scaling Big Ben's Elizabeth Tower at the Palace of Westminster in central London.  Emergency services were called at 07:24 GMT on Saturday to reports of a protester who had climbed up the tower holding a Palestinian flag. The barefoot man reached a ledge several metres up the tower and refused to leave. Emergency crews went up in a crane to negotiate with him, and he eventually came down in a cherry picker as Big Ben struck midnight, after more than 16 hours. Westmi"
2025-03-09,BBC,England aim to thrill on their own terms against Italy,https://www.bbc.com/sport/rugby-union/articles/cj92zlydyjdo,"This video can not be played ‘England can hurt Italy if they’re more ambitious in attack’ Guinness Men's Six Nations: England v Italy Date: Sunday, 9 March Kick-off: 15:00 GMT Venue: Allianz Stadium, Twickenham Coverage: Listen to full match commentary on BBC Sport website and app; follow live text commentary online; watch on ITV1 For England, Sunday is mission mundane. Some would say they have already accomplished it several times over. So far in the Six Nations, when on the turf, rather than i"
2025-03-09,BBC,NewsNews,https://www.bbc.com/news/world/middle_east,"More than 700 civilians of the Alawite religious minority have been killed, the British-based Syrian Observatory for Human Rights says. The foreign ministers of France, Germany, Italy and Britain welcomed the plan, which calls for Gaza to be rebuilt over five years.  Neuroscientists in Israel find signs that the drug helped festival survivors in the attack and the aftermath.  The president also appeared to threaten civilians in Gaza, saying they would be ""dead"" if they held hostages. They say th"
