Date,Source,Title,URL,Content
2025-03-09,BBC,'I was drawn into a secretive world of chemsex and it turned me into a zombie',https://www.bbc.com/news/articles/c4gx19vnvjlo,"A man drawn into the world of having sex while high on illegal drugs has described how he became a ""zombie"" whose life was slowly deteriorating. Chris - whose name has been changed - told the BBC he started to take part in chemsex, short for chemical sex, which helped mask the ""the shame and guilt"" he said he felt growing up gay. The Londoner said after becoming addicted to chemsex - which typically involves men who have sex with men using the drugs crystal meth, methedrone and GHB/GBL to enhanc"
2025-03-09,BBC,Climate Solutions,https://www.bbc.com/future-planet/solutions,"Scientists and industry are finding unusual new uses for brewers' spent grain – the beer industry's largest waste product. Buses from across the UK were reallocated to cover routes in Scotland while manufacturer repairs are made. The new buses run on the E1, E2 and E6 routes between Wearside and South Shields. Equatic is among a wave of start-ups exploring how the ocean could be harnessed to capture and store carbon. But not everyone is sure it's such a good idea. Talking about who is responsibl"
2025-03-09,BBC,NewsNews,https://www.bbc.com/news/world/latin_america,"Eight hours of rainfall hit Bahía Blanca, killing at least 13 people and leaving many areas under water. The Vatican said on Saturday the Pope had shown a ""good response"" in recent days to his treatment at Rome's Gemelli hospital. Crowds filled the Sambadrome to watch samba schools face off at Rio Carnival.  BlackRock will buy two ports after Trump's interest in taking back control of the key shipping route. Mexico accuses US firms of practices that help arm gangs, but the US gun trade associati"
2025-03-09,BBC,Iran criticises 'bullying countries' after Trump letter for nuclear talks,https://www.bbc.com/news/articles/cx2ed4qzp4do,"Iran's Supreme leader has criticised ""bullying"" countries in an apparent response to Donald Trump's letter demanding negotiations over its nuclear programme. Trump said on Friday he had warned Tehran in a letter it could face military action unless it agreed to talks for a nuclear deal. In a furious response on Saturday, Ayatollah Ali Khamenei said Iran would not negotiate with ""bullying governments"" insisting on talks. His regime has rapidly advanced its nuclear programme in recent years, the U"
2025-03-09,BBC,NewsNews,https://www.bbc.com/news#main-content,"More than 700 civilians of the Alawite religious minority have been killed, the British-based Syrian Observatory for Human Rights says. Indian deportee tells BBC about his risky journey and how Trump’s tactics are spreading fear.  The Irish actor says he hopes Amazon ""handles the character with dignity and imagination and respect"". Stars like Charli XCX have made see-through outfits all the rage at big events, but not everyone's a fan. The M23 rebel group has seized large parts of the mineral-ri"
2025-03-09,BBC,NewsNews,https://www.bbc.com/news/world/asia/india,"Follow live text updates, in-play video clips and BBC Test Match Special commentary as India face New Zealand in the Champions Trophy Final in Dubai. Yo Yo Honey Singh, who transformed Indian hip-hop, has made a comeback after a long battle with drug abuse. Data from India's second Time Use Survey shows that women still do far more domestic work than men. Sthal is notable for the unflinching way it portrays a bride's experience in arranged marriage. Thomas Gabriel Perera was killed by Jordanian "
2025-03-09,BBC,The SpeciaList,https://www.bbc.com/travel/specialist,"Bangkok-born actor Dom Hetrakul plays a hotel spa therapist in The White Lotus season three. Here are his top tips for visiting Phuket, Koh Samui and Bangkok. Mayara Lima is famous for her hypnotising samba style. Here, she shares the best samba experiences in Rio, from traditional school events to samba circles. Bangkok-born actor Dom Hetrakul plays a hotel spa therapist in The White Lotus season three. Here are his top tips for visiting Phuket, Koh Samui and Bangkok. Mayara Lima is famous for "
2025-03-09,BBC,Artificial Intelligence,https://www.bbc.com/innovation/artificial-intelligence,"The government is proposing changes to copyright law. The data centre, at Cambois in Northumberland, is intended to provide computing power to tech firms. The collaboration will see students and staff gain access to funding and ""cutting-edge"" AI tools. The centre is the first major new academic department at Cambridge to be established this century. The scheme, for all secondaries in Lancashire, will give a chance to learn coding and cyber security. A clip of Donald Trump Jr allegedly saying on "
2025-03-09,BBC,Arts in Motion,https://www.bbc.com/arts/arts-in-motion,"In a pioneering new collaboration, the BBC – in partnership with Rolex – will use its unparalleled reach to bring the best arts and culture to audiences worldwide. Rolex’s long-standing commitment to celebrating excellence in the arts and cultural institutions is coupled with the BBC’s storytelling heritage. This is Arts in Motion, a long-term joint project to enable and celebrate creative ambition on a global scale. For the British cellist, the cello isn't just an instrument, it's a companion a"
2025-03-09,BBC,'Free-scoring French leave Irish history tilt in tatters',https://www.bbc.com/sport/rugby-union/articles/cm2dzpxv8vdo,"Ireland allowed 34 unanswered points between the 43rd and 74th minutes of their loss to France In the end, it was the most ill-fitting of send-offs. As a video tribute to Ireland's retiring trio of legends appeared on the big screens at the Aviva Stadium after a 42-27 Six Nations defeat by France, the majority of a crowd that had felt decidedly blue-tinged throughout had already departed into the Dublin streets. Many of them were likely left trying to process what they had witnessed across the p"
2025-03-09,BBC,NewsNews,https://www.bbc.com/news,"More than 700 civilians of the Alawite religious minority have been killed, the British-based Syrian Observatory for Human Rights says. Indian deportee tells BBC about his risky journey and how Trump’s tactics are spreading fear.  The Irish actor says he hopes Amazon ""handles the character with dignity and imagination and respect"". Stars like Charli XCX have made see-through outfits all the rage at big events, but not everyone's a fan. The M23 rebel group has seized large parts of the mineral-ri"
2025-03-09,BBC,NewsNews,https://www.bbc.com/news/scotland/scotland_politics,Police Scotland is investigating the incident at the Ayshire resort owned by the Trump Organisation. It follow some of the biggest council tax increases in around 20 years at local authorities across Scotland.  The deputy leader of Reform UK said eco-policies are destroying jobs in the oil and gas sector in Scotland. Scottish Green co-leader Patrick Harvie says there is no explanation on why promised legislation to change the way homes are heated is not advancing. The Scottish government said th
2025-03-09,BBC,NewsNews,https://www.bbc.com/news/world/asia/china,"The ""Made in China"" juggernaut was built over decades. Can Trump's moves set it back? A key meeting has begun to revive China's lagging economy, which is now facing a trade war with the US. BlackRock will buy two ports after Trump's interest in taking back control of the key shipping route. The recent spree of deals between the two is upsetting traditional allies wary of Beijing.  The move comes after rights groups warned the Uyghurs face torture and possibly death back in China. A key meeting h"
2025-03-09,BBC,NewsNews,https://www.bbc.com/news/world/australia,"At least one man has died in floodwaters and military personnel have been injured in the wild weather. Thousands have been told to evacuate ahead of tropical storm's arrival on Australia's eastern coast. Australian police have been investigating the video, which circulated widely online and caused public outcry. Steve Smith retires from one-day international cricket following Australia's Champions Trophy defeat by India.  Known as the 'man with the golden arm', James Harrison's blood contained a"
2025-03-09,BBC,Recently Live,https://www.bbc.com/live/news,Copyright 2025 BBC. All rights reserved.  The BBC is not responsible for the content of external sites. Read about our approach to external linking.  
2025-03-09,BBC,"Trump's Canada 51st state plan 'is not a joke', says Foreign Minister",https://www.bbc.com/news/videos/c36wx6plkn2o,"During an interview with the BBC's Newsnight, Canada's Foreign Minister Mélanie Joly said that she takes Trump's remarks on making Canada the 51st state of his country ""very seriously"". She also said that ""this is not a joke anymore"". Her response comes after Trump's tariffs on Canada and Mexico were implemented on 4 March with Canadian energy facing a 10% tariff. The crew on the International Space Station describe what they'll miss when they return to Earth. The service provides hens, feed, an"
2025-03-09,BBC,Premier League: Build-up to Chelsea v Leicester & Tottenham v Bournemouth ,https://www.bbc.com/sport/live/ce9n915vgjgt,"Use 'watch & listen' tab for live BBC Radio commentaries  Chelsea v Leicester (14:00 GMT) - BBC Radio 5 Live commentary available Tottenham v Bournemouth (14:00 GMT) - BBC Radio 5 Live, BBC Radio London & BBC Radio Solent commentary available Charlotte Coates and Steve Sutcliffe Chelsea v Leicester (14:00 GMT) Julien LaurensEuropean football expert on BBC Radio 5 Live Bilal El Khannouss is fun to watch but there's still a lot of work to do, certainly in terms of consistency. The talent is there "
2025-03-09,BBC,Take control of your cookies,https://www.bbc.com/usingthebbc/cookies/," Cookies help us remember you and show you more things we think you’ll like.  Have a browse to see what we use them for and how you can change your settings to suit you. The page will automatically reload. You may need to reload again if the build takes longer than expected.
             Hides preview environment warning banner on preview pages. Select a theme and theme mode and click ""Load theme"" to load in your theme combination."
2025-03-09,BBC,Weather & Science,https://www.bbc.com/future-planet/weather-science,"Residents are warned power may not return for days as further heavy rainfall is forecast. Eight hours of rainfall hit Bahía Blanca, killing at least 13 people and leaving many areas under water. At least one man has died in floodwaters and military personnel have been injured in the wild weather. The BBCs Katy Watson reports from the Gold Coast, as strong winds and heavy rains batter the region. Antarctica's Circumpolar Current has a profound influence on the climate, food systems and Antarctic "
2025-03-09,BBC,NewsNews,https://www.bbc.com/news/topics/c2vdnvdg6xxt,"The foreign ministers of France, Germany, Italy and Britain welcomed the plan, which calls for Gaza to be rebuilt over five years.  They say the Arab League's proposal for post-war reconstruction fails to address realities in Gaza. Nine-year-old Rami was badly hurt in a strike which killed his brother - now he's learning to walk again. Their fate is the discussion of Arab leaders in Egypt but what do Gazans want for their future? Concern grows after Israel said it would block aid to Gaza unless "
2025-03-09,BBC,Destinations,https://www.bbc.com/travel/destinations/antarctica,"Spanish adventure athlete Antonio de la Rosa attempted to row alone through the roughest seas on the planet to Antarctica. Very little went according to plan. Not only is Deception Island littered with lore and history, it's also one of the only places on the planet where ships can sail directly into the centre of a submerged caldera. Spanish adventure athlete Antonio de la Rosa attempted to row alone through the roughest seas on the planet to Antarctica. Very little went according to plan. Not "
2025-03-09,BBC,How can I change my BBC cookie settings?,https://www.bbc.com/usingthebbc/cookies/how-can-i-change-my-bbc-cookie-settings/, Some essential features on BBC sites just won’t work without cookies. And having other cookies switched off can seriously affect the way you’ll be able to enjoy our services. Please check your cookie settings below and turn on any cookies you’re happy with. “Strictly necessary” cookies are on by default but can be turned off in your browser settings. Functional and Performance cookies can be turned on or off below and your preferences are automatically saved. You can learn more about cookies an
2025-03-09,BBC,European leaders back 'realistic' Arab plan for Gaza,https://www.bbc.com/news/articles/c0rz0jvvpwwo,"Leading European nations have said they support an Arab-backed plan for the reconstruction of Gaza that would cost $53 billion (£41 billion) and avoid displacing Palestinians from the territory.  The plan, drawn up by Egypt and endorsed by Arab leaders, has been rejected by Israel and by US President Donald Trump, who presented his own vision to turn the Gaza Strip into a ""Middle East Riviera"". On Saturday the foreign ministers of France, Germany, Italy and Britain welcomed the plan, which calls"
2025-03-09,BBC,No Title,https://www.bbc.com/newsletters, Newsletters from the BBC
2025-03-09,BBC,Entertainment & Arts,https://www.bbc.com/culture/entertainment-news,"Stars like Charli XCX have made see-through outfits all the rage at big events, but not everyone's a fan. The Irish actor says he hopes Amazon ""handles the character with dignity and imagination and respect"". The TV presenter underwent complex brain surgery in November to remove a benign brain cyst. The 95-year-old actor's Alzheimer's means it is ""quite possible"" he was unaware of his wife's death, say officials. Announced as the UK's entry, Remember Monday tell BBC Newsbeat they are feeling con"
2025-03-09,BBC,Destinations,https://www.bbc.com/travel/destinations/asia,"Cardamom and pistachios flavour this smooth and creamy frozen treat, which has origins dating as far back as the 16th Century. Hindu pilgrims have long come to Varanasi to die, believing that it will bring salvation. But by wandering aimlessly, Pico Iyer realises this city of death is actually a city of joy. Cardamom and pistachios flavour this smooth and creamy frozen treat, which has origins dating as far back as the 16th Century. Hindu pilgrims have long come to Varanasi to die, believing tha"
2025-03-09,BBC,BBC Accessibility Help,https://www.bbc.co.uk/accessibility/, All audiences are important to the BBC. This page provides links to resources and documents to help users access the BBC's content and to find out about the BBC approach to the development of rich accessible products and services.
2025-03-09,BBC,Live Now,https://www.bbc.com/live/sport,Copyright 2025 BBC. All rights reserved.  The BBC is not responsible for the content of external sites. Read about our approach to external linking.  
2025-03-09,BBC,Not so demure any more: The rise of 'free the nipple' fashion,https://www.bbc.com/news/articles/c4gp06n0d8eo,"Six months ago, a viral TikTok trend made us obsessed with being very demure and very mindful - but now, modesty has taken a back seat among celebrities who have made see-through outfits all the rage on red carpets and catwalks. At the Brit Awards last week, big winner Charli XCX went full brat as she wore a sheer black dress, prompting hundreds of complaints to media watchdog Ofcom. She used one of her acceptance speeches to address the controversy of her outfit. ""I heard that ITV were complain"
2025-03-09,BBC,NewsNews,https://www.bbc.com/news/northern_ireland/northern_ireland_politics,"Politicians from the island of Ireland are visiting Washington DC this week - but it's not without controversy. Paul Givan decided that plans by Bangor Academy and Rathmore PS to become integrated should not proceed. The prime minister is meeting his Irish counterpart as part of a UK-Ireland summit in Liverpool. A former director at the charity Age NI, Siobhan Casey, has been appointed the new Commissioner for Older People for Northern Ireland. Jon Boutcher says the programme for government does"
2025-03-09,BBC,Watch: Moment man vandalises ancient Incan artefact,https://www.bbc.com/news/videos/cn4yzywpy72o,"Footage released by Peruvian police shows a man attacking a famous Incan artefact in Cusco, with what they described as a metallic object.  According to the city's culture ministry, the incident caused 'irreversible damage' to the 12-Angle Stone, which was once part of an ancient palace.  A suspect was later detained and authorities said they believed the person behind the attack was intoxicated.  The stone is a popular tourist attraction and a symbol of the advanced stonework of the Inca civili"
2025-03-09,BBC,Travel,https://www.bbc.com/travel,"Located on a lonely mountain plain in Colorado ski country, the silver-rush-era town of Leadville holds secrets as deep as its tunnels and old mine workings. From Manchester to Reykjavík, innovative tours are highlighting forgotten stories and re-incorporating female legacies into the popular tourist narrative. From bubblegum-coloured lakes in Australia to a solar-powered safari camp in Botswana, these are BBC journalists' top destinations this year. This car-free isle off Donegal's coast was la"
2025-03-09,BBC,Sustainable Business,https://www.bbc.com/future-planet/sustainable-business,"Scientists and industry are finding unusual new uses for brewers' spent grain – the beer industry's largest waste product. Buses from across the UK were reallocated to cover routes in Scotland while manufacturer repairs are made. The new buses run on the E1, E2 and E6 routes between Wearside and South Shields. Equatic is among a wave of start-ups exploring how the ocean could be harnessed to capture and store carbon. But not everyone is sure it's such a good idea. As ocean temperatures rise, wom"
2025-03-09,BBC,Destinations,https://www.bbc.com/travel/destinations,"A new generation of Sierra Leoneans is eager to show visitors that the nation's civil war is long gone and reintroduce one of Africa's great destinations to the world. A rugged land of glaciers, mountains and fjords, South Georgia is one of the remotest places on Earth. Once symbolic of the power and wealth of the Nattukottai Chettiar community, thousands of gigantic and glamourous mansions in Tamil Nadu now lie in ruins. Each year, the small South Australian town of Whyalla becomes home to one "
2025-03-09,BBC,Learn more about what we do,https://www.bbc.co.uk/aboutthebbc," Everything you need to know about the workings of the BBC We’re impartial and independent, and every day we create distinctive, world-class programmes and content which inform, educate and entertain millions of people in the UK and around the world. We do this across: Established by a Royal Charter, the BBC is principally funded through the licence fee paid by UK households. Our role is to fulfil our mission and promote our Public Purposes. Our commercial operations including BBC Studios, the B"
2025-03-09,BBC,Contact the BBC,https://www.bbc.co.uk/contact," Menu Choose from these areas for information or help about our programmes and services. Information about issues, programmes or services which we're often asked about. Get support to resolve problems with BBC iPlayer, along with how to guides, FAQs and updates on known issues. Get support to resolve problems with BBC Sounds, along with how to guides, FAQs and updates on known issues. Details of organisations offering support if you're affected by issues in our coverage The BBC helped raise over"
2025-03-09,BBC,NewsNews,https://www.bbc.com/news/wales,"Ceri is just one of the people in Wales who has benefited from support after having a stroke. Oakwood Theme Park has shut down after almost 40 years due to a drop in visitor numbers. A 16-year-old has been arrested after the incident in Newtown on Friday evening.  Interim head coach Matt Sherratt says Wales must not fixate on breaking their record losing sequence after a 35-29 Six Nations defeat to Scotland. Every week, Elis James tries to find a mutual connection with a random Welsh caller - in"
2025-03-09,BBC,Technology,https://www.bbc.com/innovation/technology,"Cause is usually followed by effect, but in the quantum world, time's sequencing is not so straightforward. The president intervenes in a cost-cutting row after a reported clash at the White House. The at-home light therapy treatment is increasingly being seen as a must-have skincare accessory. The reserve will hold cryptocurrency forfeited to the government in criminal or civil proceedings, said the White House. There's a secret side of YouTube, just beyond the guiding hand of the algorithm – a"
2025-03-09,BBC,Guidance: Links and feeds,https://www.bbc.co.uk/editorialguidelines/guidance/feeds-and-links," This guidance note relates to the following Editorial Guidelines:  Part 1: Links  Part 2: Inbound feeds and embeds  Scope This Guidance Note is designed to help you select and manage suitable external links to other sites from BBC Online. It is also designed to help you select and manage suitable inbound feeds and other online sources of third-party content for publication on BBC Online.  For advice on distribution, including syndication, see Editorial Guidelines Section 16 External Relationshi"
2025-03-09,BBC,NewsNews,https://www.bbc.com/news/war-in-ukraine,"Russia has stepped up attacks in recent days as the US paused military and intelligence aid to Kyiv. Former national security adviser says the UK needs to be ""willing"" to deploy troops for potentially quite a long period. The president has reversed US policy and says he trusts Putin and finds dealing with Ukraine difficult.  The talks in Saudi Arabia come as both sides seek to heal a rift after presidents Zelensky and Trump clashed in public. Valerii Zaluzhnyi's comments come amid an apparent co"
2025-03-09,BBC,BBC Sport,https://www.bbc.com/sport,Premier League: Build-up to Chelsea v Leicester & Tottenham v Bournemouth  Follow live radio & text commentary plus score updates as Chelsea host Leicester & Tottenham face Bournemouth in the Premier League. Champions Trophy final: India make rapid start in pursuit of 252 England aim to thrill on their own terms against Italy France angry after Dupont suffers 'serious' injury 'The first of three finals' - how good can Liverpool's season be? 'Free-scoring French leave Irish history tilt in tatter
2025-03-09,BBC,NewsNews,https://www.bbc.com/news/england,"Lathaniel Burrell, was shot and died on Paradise Road, near Stockwell Tube station Leaseholders say they may each have to pay at least £18,000 on top of annual maintenance charges. They fled war in their home country of Sudan to seek safety in the UK, but now face homelessness. Nicola Maxwell is backing a campaign to raise awareness following the death of her son Kieran. Abhi Arumbakkam said she wanted to give herself ""permission to laugh"" in the face of rejection. Leaseholders say they may each"
2025-03-09,BBC,Watch: What did we learn from Meghan's new Netflix show?,https://www.bbc.com/news/videos/c4gmdd98804o,"The Duchess of Sussex's new lifestyle series has arrived on Netflix, showcasing her love of cooking and entertaining. But is it something to savour or more of an acquired taste?  The BBC's Daniela Relph has been taking a look.  Video editor: Serene Khalifeh   Baker is the first person to win four Oscars for one film, including Best Director. The Greenock-born actor says that despite liking life in the US, nothing beats his hometown. The actors who play Ian, Cindy, Tracey and Alfie glance back th"
2025-03-09,BBC,Destinations,https://www.bbc.com/travel/destinations/australia-and-pacific,"As of 1 December, Fiji instituted a quarantine-free travel policy to welcome vaccinated travellers from countries across the globe. The Pacific nation's audacious bid to become the world's first dark sky nation might provide a blueprint for the rest of the world. As of 1 December, Fiji instituted a quarantine-free travel policy to welcome vaccinated travellers from countries across the globe. The Pacific nation's audacious bid to become the world's first dark sky nation might provide a blueprint"
2025-03-09,BBC,Destinations,https://www.bbc.com/travel/destinations/north-america,"Stretching 113 miles into the open ocean, this engineering marvel linked the far-flung Florida Keys to the mainland and forever changed Florida. Holidays can be stressful for neurodiverse people, but Mesa, Arizona, is becoming more inclusive so that everyone can enjoy the benefits of travel – not just the neurotypical. Stretching 113 miles into the open ocean, this engineering marvel linked the far-flung Florida Keys to the mainland and forever changed Florida. Holidays can be stressful for neur"
2025-03-09,BBC,Destinations,https://www.bbc.com/travel/destinations/south-america,"Living on a remote, barren isle bestowed with few resources, the Rapanui needed to combine ingenious design with flawless sculpting to move the massive moai without any machinery. Nearly 20 years ago, Brazil banned access to its highest mountain. Now, a new initiative could show how ecotourism can protect the Amazon rainforest from environmental threats. Living on a remote, barren isle bestowed with few resources, the Rapanui needed to combine ingenious design with flawless sculpting to move the"
